<?xml version="1.0" encoding="UTF-8"?>
<!ELEMENT regions (region+) >
<!ELEMENT region (nom, liste_villes, densite) >
<!ELEMENT nom (#PCDATA) >
<!ELEMENT liste_villes (ville+) >
<!ELEMENT densite (#PCDATA) >
<!ELEMENT ville EMPTY >
<!ATTLIST ville nom CDATA #REQUIRED >
<!ATTLIST ville population CDATA #REQUIRED >
<!ATTLIST ville prefecture CDATA #IMPLIED > 